{
  "$schema": "https://json-schema.org/draft/2020-12/schema",
  "$id": "https://schemas.kumwe.org/studio/v1/blueprint.schema.json",
  "title": "Studio Blueprint",
  "type": "object",
  "additionalProperties": false,
  "required": [
    "contractVersion",
    "kind",
    "id",
    "version",
    "revision",
    "owner",
    "status",
    "label",
    "model",
    "dependencyLock",
    "roots"
  ],
  "properties": {
    "contractVersion": { "$ref": "common.schema.json#/$defs/contractVersion" },
    "kind": { "const": "blueprint" },
    "id": { "$ref": "common.schema.json#/$defs/stableId" },
    "version": { "$ref": "common.schema.json#/$defs/semanticVersion" },
    "revision": { "$ref": "common.schema.json#/$defs/revision" },
    "owner": { "$ref": "common.schema.json#/$defs/ownerReference" },
    "status": { "enum": ["draft", "published", "retired"] },
    "label": { "$ref": "common.schema.json#/$defs/messageReference" },
    "description": { "$ref": "common.schema.json#/$defs/messageReference" },
    "model": { "$ref": "common.schema.json#/$defs/lockedArtifactReference" },
    "dependencyLock": {
      "type": "object",
      "additionalProperties": false,
      "required": ["theme", "blocks"],
      "properties": {
        "theme": { "$ref": "common.schema.json#/$defs/lockedArtifactReference" },
        "blocks": {
          "type": "array",
          "maxItems": 1000,
          "items": {
            "type": "object",
            "additionalProperties": false,
            "required": ["type", "version", "revision"],
            "properties": {
              "type": { "$ref": "common.schema.json#/$defs/qualifiedName" },
              "version": { "$ref": "common.schema.json#/$defs/semanticVersion" },
              "revision": { "$ref": "common.schema.json#/$defs/revision" },
              "integrity": { "$ref": "common.schema.json#/$defs/integrity" }
            }
          }
        },
        "plugins": {
          "type": "array",
          "maxItems": 100,
          "items": { "$ref": "common.schema.json#/$defs/lockedArtifactReference" }
        }
      }
    },
    "roots": {
      "type": "array",
      "minItems": 0,
      "maxItems": 10000,
      "items": { "$ref": "#/$defs/node" }
    },
    "extensions": { "$ref": "common.schema.json#/$defs/extensions" }
  },
  "allOf": [
    {
      "if": {
        "properties": { "status": { "const": "published" } },
        "required": ["status"]
      },
      "then": {
        "properties": {
          "roots": { "type": "array", "minItems": 1 }
        }
      }
    }
  ],
  "$defs": {
    "sizeRoleAxis": { "enum": ["inline", "block"] },
    "node": {
      "type": "object",
      "additionalProperties": false,
      "required": ["id", "type", "version", "properties", "bindings", "slots", "authoring"],
      "properties": {
        "id": { "$ref": "common.schema.json#/$defs/stableId" },
        "type": { "$ref": "common.schema.json#/$defs/qualifiedName" },
        "version": { "$ref": "common.schema.json#/$defs/semanticVersion" },
        "properties": {
          "type": "object",
          "maxProperties": 500,
          "propertyNames": { "$ref": "common.schema.json#/$defs/safeJsonMemberName" },
          "additionalProperties": { "$ref": "common.schema.json#/$defs/jsonValue" }
        },
        "bindings": {
          "type": "object",
          "maxProperties": 100,
          "propertyNames": { "$ref": "common.schema.json#/$defs/localName" },
          "additionalProperties": { "$ref": "#/$defs/binding" }
        },
        "slots": {
          "type": "object",
          "maxProperties": 100,
          "propertyNames": { "$ref": "common.schema.json#/$defs/localName" },
          "additionalProperties": {
            "type": "array",
            "maxItems": 10000,
            "items": { "$ref": "#/$defs/node" }
          }
        },
        "responsive": {
          "type": "object",
          "maxProperties": 100,
          "propertyNames": { "$ref": "common.schema.json#/$defs/localName" },
          "additionalProperties": {
            "type": "object",
            "maxProperties": 20,
            "propertyNames": { "$ref": "common.schema.json#/$defs/localName" },
            "additionalProperties": { "$ref": "common.schema.json#/$defs/jsonValue" }
          }
        },
        "sizeRoles": {
          "type": "object",
          "maxProperties": 2,
          "propertyNames": { "$ref": "#/$defs/sizeRoleAxis" },
          "additionalProperties": { "$ref": "common.schema.json#/$defs/localName" }
        },
        "responsiveSizeRoles": {
          "type": "object",
          "maxProperties": 2,
          "propertyNames": { "$ref": "#/$defs/sizeRoleAxis" },
          "additionalProperties": {
            "type": "object",
            "maxProperties": 20,
            "propertyNames": { "$ref": "common.schema.json#/$defs/localName" },
            "additionalProperties": { "$ref": "common.schema.json#/$defs/localName" }
          }
        },
        "authoring": {
          "type": "object",
          "additionalProperties": false,
          "required": ["mode"],
          "properties": {
            "mode": { "enum": ["locked", "content", "variant", "structural", "designer"] },
            "allowedBlocks": {
              "type": "array",
              "maxItems": 1000,
              "uniqueItems": true,
              "items": { "$ref": "common.schema.json#/$defs/qualifiedName" }
            },
            "requiredPermission": { "$ref": "common.schema.json#/$defs/qualifiedName" },
            "slots": {
              "type": "object",
              "maxProperties": 100,
              "propertyNames": { "$ref": "common.schema.json#/$defs/localName" },
              "additionalProperties": {
                "type": "object",
                "additionalProperties": false,
                "required": ["composable"],
                "properties": {
                  "composable": { "const": true },
                  "allowedBlocks": {
                    "type": "array",
                    "maxItems": 1000,
                    "uniqueItems": true,
                    "items": { "$ref": "common.schema.json#/$defs/qualifiedName" }
                  }
                }
              }
            }
          }
        },
        "extensions": { "$ref": "common.schema.json#/$defs/extensions" }
      }
    },
    "binding": {
      "type": "object",
      "additionalProperties": false,
      "required": ["source", "transforms", "onNull", "onError"],
      "properties": {
        "source": { "$ref": "#/$defs/bindingSource" },
        "transforms": {
          "type": "array",
          "maxItems": 20,
          "items": { "$ref": "#/$defs/transform" }
        },
        "onNull": { "enum": ["empty", "hide", "fallback", "error"] },
        "onError": { "enum": ["hide", "fallback", "error"] },
        "fallback": { "$ref": "common.schema.json#/$defs/jsonValue" }
      }
    },
    "bindingSource": {
      "oneOf": [
        {
          "type": "object",
          "additionalProperties": false,
          "required": ["kind", "fieldPath"],
          "properties": {
            "kind": { "const": "entry-field" },
            "fieldPath": {
              "type": "array",
              "minItems": 1,
              "maxItems": 32,
              "items": { "$ref": "common.schema.json#/$defs/localName" }
            }
          }
        },
        {
          "type": "object",
          "additionalProperties": false,
          "required": ["kind", "key"],
          "properties": {
            "kind": { "const": "context-value" },
            "key": { "$ref": "common.schema.json#/$defs/qualifiedName" }
          }
        },
        {
          "type": "object",
          "additionalProperties": false,
          "required": ["kind", "value"],
          "properties": {
            "kind": { "const": "static-value" },
            "value": { "$ref": "common.schema.json#/$defs/jsonValue" }
          }
        },
        {
          "type": "object",
          "additionalProperties": false,
          "required": ["kind", "resourceType", "id"],
          "properties": {
            "kind": { "const": "resource-reference" },
            "resourceType": { "$ref": "common.schema.json#/$defs/qualifiedName" },
            "id": { "$ref": "common.schema.json#/$defs/stableId" }
          }
        },
        {
          "type": "object",
          "additionalProperties": false,
          "required": ["kind", "query", "version", "parameters"],
          "properties": {
            "kind": { "const": "query-reference" },
            "query": { "$ref": "common.schema.json#/$defs/qualifiedName" },
            "version": { "$ref": "common.schema.json#/$defs/semanticVersion" },
            "parameters": {
              "type": "object",
              "maxProperties": 50,
              "propertyNames": {
                "$ref": "common.schema.json#/$defs/safeJsonMemberName"
              },
              "additionalProperties": { "$ref": "common.schema.json#/$defs/jsonValue" }
            }
          }
        }
      ]
    },
    "transform": {
      "type": "object",
      "additionalProperties": false,
      "required": ["operator", "version", "arguments"],
      "properties": {
        "operator": { "$ref": "common.schema.json#/$defs/qualifiedName" },
        "version": { "$ref": "common.schema.json#/$defs/semanticVersion" },
        "arguments": {
          "type": "object",
          "maxProperties": 20,
          "propertyNames": { "$ref": "common.schema.json#/$defs/safeJsonMemberName" },
          "additionalProperties": { "$ref": "common.schema.json#/$defs/jsonValue" }
        }
      }
    }
  }
}
